original NL;original LTL;Spot LTL;APs;ap_NL;dict_AP;AP_lifted_dict;lifted_LTL
Continuously avoid parking lot 5 while repeatedly taking pictures of car 9;[]!parking_lot_5&&[]<>(car_9&&photo);G!parking_lot_5 & GF(car_9 & photo);['photo', 'parking_lot_5', 'car_9'];Continuously avoid parking_lot_5 while repeatedly taking pictures of car_9;{'photo': 'photo', 'parking lot 5': 'parking_lot_5', 'car 9': 'car_9'};{'photo': 'ap_0', 'parking_lot_5': 'ap_1', 'car_9': 'ap_2'};G!ap_1 & GF(ap_2 & ap_0)
Ensure you never enter parking lot 5 while consistently capturing photos of car 9;[]!parking_lot_5&&[]<>(car_9&&photo);G!parking_lot_5 & GF(car_9 & photo);['photo', 'parking_lot_5', 'car_9'];Ensure you never enter parking_lot_5 while consistently capturing photos of car_9;{'photo': 'photo', 'parking lot 5': 'parking_lot_5', 'car 9': 'car_9'};{'photo': 'ap_0', 'parking_lot_5': 'ap_1', 'car_9': 'ap_2'};G!ap_1 & GF(ap_2 & ap_0)
Never going to parking lot 5 as you keep photographing car 9;[]!parking_lot_5&&[]<>(car_9&&photo);G!parking_lot_5 & GF(car_9 & photo);['photo', 'parking_lot_5', 'car_9'];Never going to parking_lot_5 as you keep photographing car_9;{'photo': 'photo', 'parking lot 5': 'parking_lot_5', 'car 9': 'car_9'};{'photo': 'ap_0', 'parking_lot_5': 'ap_1', 'car_9': 'ap_2'};G!ap_1 & GF(ap_2 & ap_0)
Always stay away from parking lot 5 while persistently taking pictures of car 9;[]!parking_lot_5&&[]<>(car_9&&photo);G!parking_lot_5 & GF(car_9 & photo);['photo', 'parking_lot_5', 'car_9'];Always stay away from parking_lot_5 while persistently taking pictures of car_9;{'photo': 'photo', 'parking lot 5': 'parking_lot_5', 'car 9': 'car_9'};{'photo': 'ap_0', 'parking_lot_5': 'ap_1', 'car_9': 'ap_2'};G!ap_1 & GF(ap_2 & ap_0)
Eventually you should take a picture of arch 4 while never entering park 2;<>(arch_4&&photo)&&[]!park_2;F(arch_4 & photo) & G!park_2;['photo', 'park_2', 'arch_4'];Eventually you should take a picture of arch_4 while never entering park_2;{'photo': 'photo', 'park 2': 'park_2', 'arch 4': 'arch_4'};{'photo': 'ap_0', 'park_2': 'ap_1', 'arch_4': 'ap_2'};F(ap_2 & ap_0) & G!ap_1
Take a photo of arch 4 at some point, but avoid entering park 2 at all times;<>(arch_4&&photo)&&[]!park_2;F(arch_4 & photo) & G!park_2;['photo', 'park_2', 'arch_4'];Take a photo of arch_4 at some point, but avoid entering park_2 at all times;{'photo': 'photo', 'park 2': 'park_2', 'arch 4': 'arch_4'};{'photo': 'ap_0', 'park_2': 'ap_1', 'arch_4': 'ap_2'};F(ap_2 & ap_0) & G!ap_1
Eventually Capture a photo of arch 4 but never go to park 2;<>(arch_4&&photo)&&[]!park_2;F(arch_4 & photo) & G!park_2;['photo', 'park_2', 'arch_4'];Eventually Capture a photo of arch_4 but never go to park_2;{'photo': 'photo', 'park 2': 'park_2', 'arch 4': 'arch_4'};{'photo': 'ap_0', 'park_2': 'ap_1', 'arch_4': 'ap_2'};F(ap_2 & ap_0) & G!ap_1
Capture a photo of arch 4 but never go to park 2;<>(arch_4&&photo)&&[]!park_2;F(arch_4 & photo) & G!park_2;['photo', 'park_2', 'arch_4'];Capture a photo of arch_4 but never go to park_2;{'photo': 'photo', 'park 2': 'park_2', 'arch 4': 'arch_4'};{'photo': 'ap_0', 'park_2': 'ap_1', 'arch_4': 'ap_2'};F(ap_2 & ap_0) & G!ap_1
Always avoid entering park 2;[]!park_2;G!park_2;['park_2'];Always avoid entering park_2;{'park 2': 'park_2'};{'park_2': 'ap_0'};G!ap_0
Ensure you never go into park 2;[]!park_2;G!park_2;['park_2'];Ensure you never go into park_2;{'park 2': 'park_2'};{'park_2': 'ap_0'};G!ap_0
Refrain from entering park 2 at all times;[]!park_2;G!park_2;['park_2'];Refrain from entering park_2 at all times;{'park 2': 'park_2'};{'park_2': 'ap_0'};G!ap_0
Stay away from park 2 permanently;[]!park_2;G!park_2;['park_2'];Stay away from park_2 permanently;{'park 2': 'park_2'};{'park_2': 'ap_0'};G!ap_0
Remain in building 9 until you pick up bottle 3 from room 2 and deliver it to room 6;building_9 U (room_2&&<>(p_bottle_3&&<>(room_6&&pd)));building_9 U (room_2 & F(p_bottle_3 & F(pd & room_6)));['pd', 'p_bottle_3', 'room_2', 'building_9', 'room_6'];Remain in building_9 until you pick up p_bottle_3 from room_2 and deliver it to room_6;{'pd': 'pd', 'bottle 3': 'p_bottle_3', 'room 2': 'room_2', 'building 9': 'building_9', 'room 6': 'room_6'};{'pd': 'ap_0', 'p_bottle_3': 'ap_1', 'room_2': 'ap_2', 'building_9': 'ap_3', 'room_6': 'ap_4'};ap_3 U (ap_2 & F(ap_1 & F(ap_0 & ap_4)))
Stay within building 9 until you collect bottle 3 from room 2 and take it to room 6;building_9 U (room_2&&<>(p_bottle_3&&<>(room_6&&pd)));building_9 U (room_2 & F(p_bottle_3 & F(pd & room_6)));['pd', 'p_bottle_3', 'room_2', 'building_9', 'room_6'];Stay within building_9 until you collect p_bottle_3 from room_2 and take it to room_6;{'pd': 'pd', 'bottle 3': 'p_bottle_3', 'room 2': 'room_2', 'building 9': 'building_9', 'room 6': 'room_6'};{'pd': 'ap_0', 'p_bottle_3': 'ap_1', 'room_2': 'ap_2', 'building_9': 'ap_3', 'room_6': 'ap_4'};ap_3 U (ap_2 & F(ap_1 & F(ap_0 & ap_4)))
Stay within building 9 before retrieving bottle 3 from room 2 and transporting it to room 6;building_9 U (room_2&&<>(p_bottle_3&&<>(room_6&&pd)));building_9 U (room_2 & F(p_bottle_3 & F(pd & room_6)));['pd', 'p_bottle_3', 'room_2', 'building_9', 'room_6'];Stay within building_9 before retrieving p_bottle_3 from room_2 and transporting it to room_6;{'pd': 'pd', 'bottle 3': 'p_bottle_3', 'room 2': 'room_2', 'building 9': 'building_9', 'room 6': 'room_6'};{'pd': 'ap_0', 'p_bottle_3': 'ap_1', 'room_2': 'ap_2', 'building_9': 'ap_3', 'room_6': 'ap_4'};ap_3 U (ap_2 & F(ap_1 & F(ap_0 & ap_4)))
Continue staying in building 9 until you pick up bottle 3 from room 2 and place it in room 6;building_9 U (room_2&&<>(p_bottle_3&&<>(room_6&&pd)));building_9 U (room_2 & F(p_bottle_3 & F(pd & room_6)));['pd', 'p_bottle_3', 'room_2', 'building_9', 'room_6'];Continue staying in building_9 until you pick up p_bottle_3 from room_2 and place it in room_6;{'pd': 'pd', 'bottle 3': 'p_bottle_3', 'room 2': 'room_2', 'building 9': 'building_9', 'room 6': 'room_6'};{'pd': 'ap_0', 'p_bottle_3': 'ap_1', 'room_2': 'ap_2', 'building_9': 'ap_3', 'room_6': 'ap_4'};ap_3 U (ap_2 & F(ap_1 & F(ap_0 & ap_4)))
Stay within locality 1 until you arrive at intersection 4, after which deliver package 5 from warehouse 9 to store 2;locality_1 U intersection_4&&<>(warehouse_9&&<>(p_package_5&&<>(store_2&&pd)));(locality_1 U intersection_4) & F(warehouse_9 & F(p_package_5 & F(pd & store_2)));['pd', 'p_package_5', 'store_2', 'intersection_4', 'locality_1', 'warehouse_9'];Stay within locality_1 until you arrive at intersection_4, after which deliver p_package_5 from warehouse_9 to store_2;{'pd': 'pd', 'package 5': 'p_package_5', 'store 2': 'store_2', 'intersection 4': 'intersection_4', 'locality 1': 'locality_1', 'warehouse 9': 'warehouse_9'};{'pd': 'ap_0', 'p_package_5': 'ap_1', 'store_2': 'ap_2', 'intersection_4': 'ap_3', 'locality_1': 'ap_4', 'warehouse_9': 'ap_5'};(ap_4 U ap_3) & F(ap_5 & F(ap_1 & F(ap_0 & ap_2)))
Stay within locality 1 until you arrive at intersection 4, after which take package 5 from warehouse 9 to store 2;locality_1 U intersection_4&&<>(warehouse_9&&<>(p_package_5&&<>(store_2&&pd)));(locality_1 U intersection_4) & F(warehouse_9 & F(p_package_5 & F(pd & store_2)));['pd', 'p_package_5', 'store_2', 'intersection_4', 'locality_1', 'warehouse_9'];Stay within locality_1 until you arrive at intersection_4, after which take p_package_5 from warehouse_9 to store_2;{'pd': 'pd', 'package 5': 'p_package_5', 'store 2': 'store_2', 'intersection 4': 'intersection_4', 'locality 1': 'locality_1', 'warehouse 9': 'warehouse_9'};{'pd': 'ap_0', 'p_package_5': 'ap_1', 'store_2': 'ap_2', 'intersection_4': 'ap_3', 'locality_1': 'ap_4', 'warehouse_9': 'ap_5'};(ap_4 U ap_3) & F(ap_5 & F(ap_1 & F(ap_0 & ap_2)))
Do not leave locality 1 before reaching intersection 4, and then ensure package 5 is delivered from warehouse 9 to store 2;locality_1 U intersection_4&&<>(warehouse_9&&<>(p_package_5&&<>(store_2&&pd)));(locality_1 U intersection_4) & F(warehouse_9 & F(p_package_5 & F(pd & store_2)));['pd', 'p_package_5', 'store_2', 'intersection_4', 'locality_1', 'warehouse_9'];Do not leave locality_1 before reaching intersection_4, and then ensure p_package_5 is delivered from warehouse_9 to store_2;{'pd': 'pd', 'package 5': 'p_package_5', 'store 2': 'store_2', 'intersection 4': 'intersection_4', 'locality 1': 'locality_1', 'warehouse 9': 'warehouse_9'};{'pd': 'ap_0', 'p_package_5': 'ap_1', 'store_2': 'ap_2', 'intersection_4': 'ap_3', 'locality_1': 'ap_4', 'warehouse_9': 'ap_5'};(ap_4 U ap_3) & F(ap_5 & F(ap_1 & F(ap_0 & ap_2)))
Remain in locality 1 until you arrive intersection 4 as you take package 5 from warehouse 9 to store 2;locality_1 U intersection_4&&<>(warehouse_9&&<>(p_package_5&&<>(store_2&&pd)));(locality_1 U intersection_4) & F(warehouse_9 & F(p_package_5 & F(pd & store_2)));['pd', 'p_package_5', 'store_2', 'intersection_4', 'locality_1', 'warehouse_9'];Remain in locality_1 until you arrive intersection_4 as you take p_package_5 from warehouse_9 to store_2;{'pd': 'pd', 'package 5': 'p_package_5', 'store 2': 'store_2', 'intersection 4': 'intersection_4', 'locality 1': 'locality_1', 'warehouse 9': 'warehouse_9'};{'pd': 'ap_0', 'p_package_5': 'ap_1', 'store_2': 'ap_2', 'intersection_4': 'ap_3', 'locality_1': 'ap_4', 'warehouse_9': 'ap_5'};(ap_4 U ap_3) & F(ap_5 & F(ap_1 & F(ap_0 & ap_2)))
Keep capturing photos of statue 4 and also keep returning to charger 4;[]<>(statue_4&&photo)&&[]<>charger_4;GF(photo & statue_4) & GFcharger_4;['photo', 'charger_4', 'statue_4'];Keep capturing photos of statue_4 and also keep returning to charger_4;{'photo': 'photo', 'charger 4': 'charger_4', 'statue 4': 'statue_4'};{'photo': 'ap_0', 'charger_4': 'ap_1', 'statue_4': 'ap_2'};GF(ap_0 & ap_2) & GFap_1
Keep photographing statue 4 while ensuring you also keep revisiting charger 4;[]<>(statue_4&&photo)&&[]<>charger_4;GF(photo & statue_4) & GFcharger_4;['photo', 'charger_4', 'statue_4'];Keep photographing statue_4 while ensuring you also keep revisiting charger_4;{'photo': 'photo', 'charger 4': 'charger_4', 'statue 4': 'statue_4'};{'photo': 'ap_0', 'charger_4': 'ap_1', 'statue_4': 'ap_2'};GF(ap_0 & ap_2) & GFap_1
Repeatedly capture photos of statue 4 while persistently returning to charger 4;[]<>(statue_4&&photo)&&[]<>charger_4;GF(photo & statue_4) & GFcharger_4;['photo', 'charger_4', 'statue_4'];Repeatedly capture photos of statue_4 while persistently returning to charger_4;{'photo': 'photo', 'charger 4': 'charger_4', 'statue 4': 'statue_4'};{'photo': 'ap_0', 'charger_4': 'ap_1', 'statue_4': 'ap_2'};GF(ap_0 & ap_2) & GFap_1
Ensure you continuously take pictures of statue 4 while regularly visiting charger 4;[]<>(statue_4&&photo)&&[]<>charger_4;GF(photo & statue_4) & GFcharger_4;['photo', 'charger_4', 'statue_4'];Ensure you continuously take pictures of statue_4 while regularly visiting charger_4;{'photo': 'photo', 'charger 4': 'charger_4', 'statue 4': 'statue_4'};{'photo': 'ap_0', 'charger_4': 'ap_1', 'statue_4': 'ap_2'};GF(ap_0 & ap_2) & GFap_1
Remain in street 4 until you take a picture of house 1;street_4 U (house_1&&photo);street_4 U (house_1 & photo);['photo', 'street_4', 'house_1'];Remain in street_4 until you take a picture of house_1;{'photo': 'photo', 'street 4': 'street_4', 'house 1': 'house_1'};{'photo': 'ap_0', 'street_4': 'ap_1', 'house_1': 'ap_2'};ap_1 U (ap_2 & ap_0)
Stay within street 4 until you capture a photo of house 1;street_4 U (house_1&&photo);street_4 U (house_1 & photo);['photo', 'street_4', 'house_1'];Stay within street_4 until you capture a photo of house_1;{'photo': 'photo', 'street 4': 'street_4', 'house 1': 'house_1'};{'photo': 'ap_0', 'street_4': 'ap_1', 'house_1': 'ap_2'};ap_1 U (ap_2 & ap_0)
Stay in street 4 until you take a photo of house 1;street_4 U (house_1&&photo);street_4 U (house_1 & photo);['photo', 'street_4', 'house_1'];Stay in street_4 until you take a photo of house_1;{'photo': 'photo', 'street 4': 'street_4', 'house 1': 'house_1'};{'photo': 'ap_0', 'street_4': 'ap_1', 'house_1': 'ap_2'};ap_1 U (ap_2 & ap_0)
Continue staying in street 4 until you successfully photograph house 1;street_4 U (house_1&&photo);street_4 U (house_1 & photo);['photo', 'street_4', 'house_1'];Continue staying in street_4 until you successfully photograph house_1;{'photo': 'photo', 'street 4': 'street_4', 'house 1': 'house_1'};{'photo': 'ap_0', 'street_4': 'ap_1', 'house_1': 'ap_2'};ap_1 U (ap_2 & ap_0)
Pick up brochure 5 from table 2 and deliver it to street 5;<>(table_2&&<>(p_brochure_5&&<>(street_5&&pd)));F(table_2 & F(p_brochure_5 & F(pd & street_5)));['pd', 'street_5', 'table_2', 'p_brochure_5'];Pick up p_brochure_5 from table_2 and deliver it to street_5;{'pd': 'pd', 'street 5': 'street_5', 'table 2': 'table_2', 'brochure 5': 'p_brochure_5'};{'pd': 'ap_0', 'street_5': 'ap_1', 'table_2': 'ap_2', 'p_brochure_5': 'ap_3'};F(ap_2 & F(ap_3 & F(ap_0 & ap_1)))
Ensure you collect brochure 5 from table 2 and place it in street 5;<>(table_2&&<>(p_brochure_5&&<>(street_5&&pd)));F(table_2 & F(p_brochure_5 & F(pd & street_5)));['pd', 'street_5', 'table_2', 'p_brochure_5'];Ensure you collect p_brochure_5 from table_2 and place it in street_5;{'pd': 'pd', 'street 5': 'street_5', 'table 2': 'table_2', 'brochure 5': 'p_brochure_5'};{'pd': 'ap_0', 'street_5': 'ap_1', 'table_2': 'ap_2', 'p_brochure_5': 'ap_3'};F(ap_2 & F(ap_3 & F(ap_0 & ap_1)))
Retrieve brochure 5 from table 2 and subsequently put it to street 5;<>(table_2&&<>(p_brochure_5&&<>(street_5&&pd)));F(table_2 & F(p_brochure_5 & F(pd & street_5)));['pd', 'street_5', 'table_2', 'p_brochure_5'];Retrieve p_brochure_5 from table_2 and subsequently put it to street_5;{'pd': 'pd', 'street 5': 'street_5', 'table 2': 'table_2', 'brochure 5': 'p_brochure_5'};{'pd': 'ap_0', 'street_5': 'ap_1', 'table_2': 'ap_2', 'p_brochure_5': 'ap_3'};F(ap_2 & F(ap_3 & F(ap_0 & ap_1)))
Start by picking up brochure 5 from table 2 and then put it in street 5;<>(table_2&&<>(p_brochure_5&&<>(street_5&&pd)));F(table_2 & F(p_brochure_5 & F(pd & street_5)));['pd', 'street_5', 'table_2', 'p_brochure_5'];Start by picking up p_brochure_5 from table_2 and then put it in street_5;{'pd': 'pd', 'street 5': 'street_5', 'table 2': 'table_2', 'brochure 5': 'p_brochure_5'};{'pd': 'ap_0', 'street_5': 'ap_1', 'table_2': 'ap_2', 'p_brochure_5': 'ap_3'};F(ap_2 & F(ap_3 & F(ap_0 & ap_1)))
Continuously transport box 2 from store 4 to hall 8;[]<>(store_4&&<>(p_box_2&&<>(hall_8&&pd)));GF(store_4 & F(p_box_2 & F(hall_8 & pd)));['pd', 'store_4', 'p_box_2', 'hall_8'];Continuously transport p_box_2 from store_4 to hall_8;{'pd': 'pd', 'store 4': 'store_4', 'box 2': 'p_box_2', 'hall 8': 'hall_8'};{'pd': 'ap_0', 'store_4': 'ap_1', 'p_box_2': 'ap_2', 'hall_8': 'ap_3'};GF(ap_1 & F(ap_2 & F(ap_3 & ap_0)))
Repeatedly take box 2 from store 4 and deliver it to hall 8;[]<>(store_4&&<>(p_box_2&&<>(hall_8&&pd)));GF(store_4 & F(p_box_2 & F(hall_8 & pd)));['pd', 'store_4', 'p_box_2', 'hall_8'];Repeatedly take p_box_2 from store_4 and deliver it to hall_8;{'pd': 'pd', 'store 4': 'store_4', 'box 2': 'p_box_2', 'hall 8': 'hall_8'};{'pd': 'ap_0', 'store_4': 'ap_1', 'p_box_2': 'ap_2', 'hall_8': 'ap_3'};GF(ap_1 & F(ap_2 & F(ap_3 & ap_0)))
Ensure you keep moving box 2 from store 4 to hall 8;[]<>(store_4&&<>(p_box_2&&<>(hall_8&&pd)));GF(store_4 & F(p_box_2 & F(hall_8 & pd)));['pd', 'store_4', 'p_box_2', 'hall_8'];Ensure you keep moving p_box_2 from store_4 to hall_8;{'pd': 'pd', 'store 4': 'store_4', 'box 2': 'p_box_2', 'hall 8': 'hall_8'};{'pd': 'ap_0', 'store_4': 'ap_1', 'p_box_2': 'ap_2', 'hall_8': 'ap_3'};GF(ap_1 & F(ap_2 & F(ap_3 & ap_0)))
Persistently transfer box 2 from store 4 to hall 8;[]<>(store_4&&<>(p_box_2&&<>(hall_8&&pd)));GF(store_4 & F(p_box_2 & F(hall_8 & pd)));['pd', 'store_4', 'p_box_2', 'hall_8'];Persistently transfer p_box_2 from store_4 to hall_8;{'pd': 'pd', 'store 4': 'store_4', 'box 2': 'p_box_2', 'hall 8': 'hall_8'};{'pd': 'ap_0', 'store_4': 'ap_1', 'p_box_2': 'ap_2', 'hall_8': 'ap_3'};GF(ap_1 & F(ap_2 & F(ap_3 & ap_0)))
Ensure you avoid entering parking lot 5 while taking a picture of car 3;[]!parking_lot_5&&<>(car_3&&photo);G!parking_lot_5 & F(car_3 & photo);['photo', 'parking_lot_5', 'car_3'];Ensure you avoid entering parking_lot_5 while taking a picture of car_3;{'photo': 'photo', 'parking lot 5': 'parking_lot_5', 'car 3': 'car_3'};{'photo': 'ap_0', 'parking_lot_5': 'ap_1', 'car_3': 'ap_2'};G!ap_1 & F(ap_2 & ap_0)
Never go to parking lot 5 as you capture a photo of car 3;[]!parking_lot_5&&<>(car_3&&photo);G!parking_lot_5 & F(car_3 & photo);['photo', 'parking_lot_5', 'car_3'];Never go to parking_lot_5 as you capture a photo of car_3;{'photo': 'photo', 'parking lot 5': 'parking_lot_5', 'car 3': 'car_3'};{'photo': 'ap_0', 'parking_lot_5': 'ap_1', 'car_3': 'ap_2'};G!ap_1 & F(ap_2 & ap_0)
Refrain from visiting parking lot 5 while photographing car 3;[]!parking_lot_5&&<>(car_3&&photo);G!parking_lot_5 & F(car_3 & photo);['photo', 'parking_lot_5', 'car_3'];Refrain from visiting parking_lot_5 while photographing car_3;{'photo': 'photo', 'parking lot 5': 'parking_lot_5', 'car 3': 'car_3'};{'photo': 'ap_0', 'parking_lot_5': 'ap_1', 'car_3': 'ap_2'};G!ap_1 & F(ap_2 & ap_0)
Always stay away from parking lot 5 while ensuring you take a picture of car 3;[]!parking_lot_5&&<>(car_3&&photo);G!parking_lot_5 & F(car_3 & photo);['photo', 'parking_lot_5', 'car_3'];Always stay away from parking_lot_5 while ensuring you take a picture of car_3;{'photo': 'photo', 'parking lot 5': 'parking_lot_5', 'car 3': 'car_3'};{'photo': 'ap_0', 'parking_lot_5': 'ap_1', 'car_3': 'ap_2'};G!ap_1 & F(ap_2 & ap_0)
Retrieve package 4 from store 2 and then deliver it to house 4;<>(store_2&&<>(p_package_4&&<>(house_4&&pd)));F(store_2 & F(p_package_4 & F(house_4 & pd)));['pd', 'p_package_4', 'house_4', 'store_2'];Retrieve p_package_4 from store_2 and then deliver it to house_4;{'pd': 'pd', 'package 4': 'p_package_4', 'house 4': 'house_4', 'store 2': 'store_2'};{'pd': 'ap_0', 'p_package_4': 'ap_1', 'house_4': 'ap_2', 'store_2': 'ap_3'};F(ap_3 & F(ap_1 & F(ap_2 & ap_0)))
Pick up package 4 from store 2 and place it in house 4;<>(store_2&&<>(p_package_4&&<>(house_4&&pd)));F(store_2 & F(p_package_4 & F(house_4 & pd)));['pd', 'p_package_4', 'house_4', 'store_2'];Pick up p_package_4 from store_2 and place it in house_4;{'pd': 'pd', 'package 4': 'p_package_4', 'house 4': 'house_4', 'store 2': 'store_2'};{'pd': 'ap_0', 'p_package_4': 'ap_1', 'house_4': 'ap_2', 'store_2': 'ap_3'};F(ap_3 & F(ap_1 & F(ap_2 & ap_0)))
Ensure you collect package 4 from store 2 and then put it in house 4;<>(store_2&&<>(p_package_4&&<>(house_4&&pd)));F(store_2 & F(p_package_4 & F(house_4 & pd)));['pd', 'p_package_4', 'house_4', 'store_2'];Ensure you collect p_package_4 from store_2 and then put it in house_4;{'pd': 'pd', 'package 4': 'p_package_4', 'house 4': 'house_4', 'store 2': 'store_2'};{'pd': 'ap_0', 'p_package_4': 'ap_1', 'house_4': 'ap_2', 'store_2': 'ap_3'};F(ap_3 & F(ap_1 & F(ap_2 & ap_0)))
Get package 4 from store 2 and subsequently transport it to house 4;<>(store_2&&<>(p_package_4&&<>(house_4&&pd)));F(store_2 & F(p_package_4 & F(house_4 & pd)));['pd', 'p_package_4', 'house_4', 'store_2'];Get p_package_4 from store_2 and subsequently transport it to house_4;{'pd': 'pd', 'package 4': 'p_package_4', 'house 4': 'house_4', 'store 2': 'store_2'};{'pd': 'ap_0', 'p_package_4': 'ap_1', 'house_4': 'ap_2', 'store_2': 'ap_3'};F(ap_3 & F(ap_1 & F(ap_2 & ap_0)))
Take a picture of statue 6, then go to bench 4 and remain there;<>(statue_6&&photo&&<>(bench_4&&[]bench_4));F(photo & statue_6 & F(bench_4 & Gbench_4));['photo', 'statue_6', 'bench_4'];Take a picture of statue_6, then go to bench_4 and remain there;{'photo': 'photo', 'statue 6': 'statue_6', 'bench 4': 'bench_4'};{'photo': 'ap_0', 'statue_6': 'ap_1', 'bench_4': 'ap_2'};F(ap_0 & ap_1 & F(ap_2 & Gap_2))
Ensure you capture a photo of statue 6 and afterward proceed to bench 4 and stay;<>(statue_6&&photo&&<>(bench_4&&[]bench_4));F(photo & statue_6 & F(bench_4 & Gbench_4));['photo', 'statue_6', 'bench_4'];Ensure you capture a photo of statue_6 and afterward proceed to bench_4 and stay;{'photo': 'photo', 'statue 6': 'statue_6', 'bench 4': 'bench_4'};{'photo': 'ap_0', 'statue_6': 'ap_1', 'bench_4': 'ap_2'};F(ap_0 & ap_1 & F(ap_2 & Gap_2))
Photograph statue 6 and then move to bench 4, staying there continuously;<>(statue_6&&photo&&<>(bench_4&&[]bench_4));F(photo & statue_6 & F(bench_4 & Gbench_4));['photo', 'statue_6', 'bench_4'];Photograph statue_6 and then move to bench_4, staying there continuously;{'photo': 'photo', 'statue 6': 'statue_6', 'bench 4': 'bench_4'};{'photo': 'ap_0', 'statue_6': 'ap_1', 'bench_4': 'ap_2'};F(ap_0 & ap_1 & F(ap_2 & Gap_2))
Take a photo of statue 6 and then go to bench 4 and remain there;<>(statue_6&&photo&&<>(bench_4&&[]bench_4));F(photo & statue_6 & F(bench_4 & Gbench_4));['photo', 'statue_6', 'bench_4'];Take a photo of statue_6 and then go to bench_4 and remain there;{'photo': 'photo', 'statue 6': 'statue_6', 'bench 4': 'bench_4'};{'photo': 'ap_0', 'statue_6': 'ap_1', 'bench_4': 'ap_2'};F(ap_0 & ap_1 & F(ap_2 & Gap_2))
Ensure you repeatedly transport crate 4 from warehouse 3 to store 9, and also periodically visit charger 3;[]<>(warehouse_3&&<>(p_crate_4&&<>(store_9&&pd)))&&[]<>charger_3;GF(warehouse_3 & F(p_crate_4 & F(pd & store_9))) & GFcharger_3;['warehouse_3', 'p_crate_4', 'pd', 'store_9', 'charger_3'];Ensure you repeatedly transport p_crate_4 from warehouse_3 to store_9, and also periodically visit charger_3;{'warehouse 3': 'warehouse_3', 'crate 4': 'p_crate_4', 'pd': 'pd', 'store 9': 'store_9', 'charger 3': 'charger_3'};{'warehouse_3': 'ap_0', 'p_crate_4': 'ap_1', 'pd': 'ap_2', 'store_9': 'ap_3', 'charger_3': 'ap_4'};GF(ap_0 & F(ap_1 & F(ap_2 & ap_3))) & GFap_4
Ensure you repeatedly move crate 4 from warehouse 3 to store 9, and also periodically revisit charger 3;[]<>(warehouse_3&&<>(p_crate_4&&<>(store_9&&pd)))&&[]<>charger_3;GF(warehouse_3 & F(p_crate_4 & F(pd & store_9))) & GFcharger_3;['warehouse_3', 'p_crate_4', 'pd', 'store_9', 'charger_3'];Ensure you repeatedly move p_crate_4 from warehouse_3 to store_9, and also periodically revisit charger_3;{'warehouse 3': 'warehouse_3', 'crate 4': 'p_crate_4', 'pd': 'pd', 'store 9': 'store_9', 'charger 3': 'charger_3'};{'warehouse_3': 'ap_0', 'p_crate_4': 'ap_1', 'pd': 'ap_2', 'store_9': 'ap_3', 'charger_3': 'ap_4'};GF(ap_0 & F(ap_1 & F(ap_2 & ap_3))) & GFap_4
Persistently take crate 4 from warehouse 3 to store 9 while consistently visiting charger 3;[]<>(warehouse_3&&<>(p_crate_4&&<>(store_9&&pd)))&&[]<>charger_3;GF(warehouse_3 & F(p_crate_4 & F(pd & store_9))) & GFcharger_3;['warehouse_3', 'p_crate_4', 'pd', 'store_9', 'charger_3'];Persistently take p_crate_4 from warehouse_3 to store_9 while consistently visiting charger_3;{'warehouse 3': 'warehouse_3', 'crate 4': 'p_crate_4', 'pd': 'pd', 'store 9': 'store_9', 'charger 3': 'charger_3'};{'warehouse_3': 'ap_0', 'p_crate_4': 'ap_1', 'pd': 'ap_2', 'store_9': 'ap_3', 'charger_3': 'ap_4'};GF(ap_0 & F(ap_1 & F(ap_2 & ap_3))) & GFap_4
Keep transferring crate 4 from warehouse 3 to store 9 while periodically returning to charger 3;[]<>(warehouse_3&&<>(p_crate_4&&<>(store_9&&pd)))&&[]<>charger_3;GF(warehouse_3 & F(p_crate_4 & F(pd & store_9))) & GFcharger_3;['warehouse_3', 'p_crate_4', 'pd', 'store_9', 'charger_3'];Keep transferring p_crate_4 from warehouse_3 to store_9 while periodically returning to charger_3;{'warehouse 3': 'warehouse_3', 'crate 4': 'p_crate_4', 'pd': 'pd', 'store 9': 'store_9', 'charger 3': 'charger_3'};{'warehouse_3': 'ap_0', 'p_crate_4': 'ap_1', 'pd': 'ap_2', 'store_9': 'ap_3', 'charger_3': 'ap_4'};GF(ap_0 & F(ap_1 & F(ap_2 & ap_3))) & GFap_4
Keep returning to charger 3 as you repeatedly take photos of area 3;[]<>charger_3&&[]<>(area_3&&photo);GFcharger_3 & GF(area_3 & photo);['charger_3', 'area_3', 'photo'];Keep returning to charger_3 as you repeatedly take photos of area_3;{'charger 3': 'charger_3', 'area 3': 'area_3', 'photo': 'photo'};{'charger_3': 'ap_0', 'area_3': 'ap_1', 'photo': 'ap_2'};GFap_0 & GF(ap_1 & ap_2)
Repeatedly visit charger 3 while repeatedly taking pictures of area 3;[]<>charger_3&&[]<>(area_3&&photo);GFcharger_3 & GF(area_3 & photo);['charger_3', 'area_3', 'photo'];Repeatedly visit charger_3 while repeatedly taking pictures of area_3;{'charger 3': 'charger_3', 'area 3': 'area_3', 'photo': 'photo'};{'charger_3': 'ap_0', 'area_3': 'ap_1', 'photo': 'ap_2'};GFap_0 & GF(ap_1 & ap_2)
Persistently return to charger 3 as you consistently photograph area 3;[]<>charger_3&&[]<>(area_3&&photo);GFcharger_3 & GF(area_3 & photo);['charger_3', 'area_3', 'photo'];Persistently return to charger_3 as you consistently photograph area_3;{'charger 3': 'charger_3', 'area 3': 'area_3', 'photo': 'photo'};{'charger_3': 'ap_0', 'area_3': 'ap_1', 'photo': 'ap_2'};GFap_0 & GF(ap_1 & ap_2)
Keep returning to charger 3 as you periodically take photos of area 3;[]<>charger_3&&[]<>(area_3&&photo);GFcharger_3 & GF(area_3 & photo);['charger_3', 'area_3', 'photo'];Keep returning to charger_3 as you periodically take photos of area_3;{'charger 3': 'charger_3', 'area 3': 'area_3', 'photo': 'photo'};{'charger_3': 'ap_0', 'area_3': 'ap_1', 'photo': 'ap_2'};GFap_0 & GF(ap_1 & ap_2)
Visit mall 5, pick up box 4, and deliver it to house 1;<>(mall_5&&<>(p_box_4&&<>(house_1&&pd)));F(mall_5 & F(p_box_4 & F(house_1 & pd)));['pd', 'house_1', 'mall_5', 'p_box_4'];Visit mall_5, pick up p_box_4, and deliver it to house_1;{'pd': 'pd', 'house 1': 'house_1', 'mall 5': 'mall_5', 'box 4': 'p_box_4'};{'pd': 'ap_0', 'house_1': 'ap_1', 'mall_5': 'ap_2', 'p_box_4': 'ap_3'};F(ap_2 & F(ap_3 & F(ap_1 & ap_0)))
