original NL;original LTL;Spot LTL;APs;ap_NL;dict_AP;AP_lifted_dict;lifted_LTL
Stay within house 4 and do not leave until you reach room 2;house_4 U room_2;house_4 U room_2;['house_4', 'room_2'];Stay within house_4 and do not leave until you reach room_2;{'house 4': 'house_4', 'room 2': 'room_2'};{'house_4': 'ap_0', 'room_2': 'ap_1'};ap_0 U ap_1
Avoid visiting house 4 for the purpose of picking up bottle 2;[]!(house_4&&p_bottle_2);G!(house_4 & p_bottle_2);['house_4', 'p_bottle_2'];Avoid visiting house_4 for the purpose of picking up p_bottle_2;{'house 4': 'house_4', 'bottle 2': 'p_bottle_2'};{'house_4': 'ap_0', 'p_bottle_2': 'ap_1'};G!(ap_0 & ap_1)
Ensure that you always stay within area 3;[]area_3;Garea_3;['area_3'];Ensure that you always stay within area_3;{'area 3': 'area_3'};{'area_3': 'ap_0'};Gap_0
Visit mall 5 and do not leave after arriving;<>[]mall_5;FGmall_5;['mall_5'];Visit mall_5 and do not leave after arriving;{'mall 5': 'mall_5'};{'mall_5': 'ap_0'};FGap_0
Ensure you stay away from intersection 5 until street 4 is reached, while delivering pass 4 from house 4 to office 1;!intersection_5 U street_4&&<>(house_4&&<>(p_pass_4&&<>(office_1&&pd)));(!intersection_5 U street_4) & F(house_4 & F(p_pass_4 & F(office_1 & pd)));['pd', 'street_4', 'house_4', 'intersection_5', 'p_pass_4', 'office_1'];Ensure you stay away from intersection_5 until street_4 is reached, while delivering p_pass_4 from house_4 to office_1;{'pd': 'pd', 'street 4': 'street_4', 'house 4': 'house_4', 'intersection 5': 'intersection_5', 'pass 4': 'p_pass_4', 'office 1': 'office_1'};{'pd': 'ap_0', 'street_4': 'ap_1', 'house_4': 'ap_2', 'intersection_5': 'ap_3', 'p_pass_4': 'ap_4', 'office_1': 'ap_5'};(!ap_3 U ap_1) & F(ap_2 & F(ap_4 & F(ap_5 & ap_0)))
Find your way to park 5;<>park_5;Fpark_5;['park_5'];Find your way to park_5;{'park 5': 'park_5'};{'park_5': 'ap_0'};Fap_0
Keep retrieving crate 8 from mall 5 and taking it to office 6 repeatedly;[]<>(mall_5&&<>(p_crate_8&&<>(office_6&&pd)));GF(mall_5 & F(p_crate_8 & F(office_6 & pd)));['pd', 'mall_5', 'p_crate_8', 'office_6'];Keep retrieving p_crate_8 from mall_5 and taking it to office_6 repeatedly;{'pd': 'pd', 'mall 5': 'mall_5', 'crate 8': 'p_crate_8', 'office 6': 'office_6'};{'pd': 'ap_0', 'mall_5': 'ap_1', 'p_crate_8': 'ap_2', 'office_6': 'ap_3'};GF(ap_1 & F(ap_2 & F(ap_3 & ap_0)))
Remain at parking lot 4 until you have taken a photo of car 5;parking_lot_4 U (car_5&&photo);parking_lot_4 U (car_5 & photo);['photo', 'parking_lot_4', 'car_5'];Remain at parking_lot_4 until you have taken a photo of car_5;{'photo': 'photo', 'parking lot 4': 'parking_lot_4', 'car 5': 'car_5'};{'photo': 'ap_0', 'parking_lot_4': 'ap_1', 'car_5': 'ap_2'};ap_1 U (ap_2 & ap_0)
Ensure you stay away from building 8 until parking lot 8 is visited;!building_8 U parking_lot_8;!building_8 U parking_lot_8;['building_8', 'parking_lot_8'];Ensure you stay away from building_8 until parking_lot_8 is visited;{'building 8': 'building_8', 'parking lot 8': 'parking_lot_8'};{'building_8': 'ap_0', 'parking_lot_8': 'ap_1'};!ap_0 U ap_1
Do not interact with crate 8 by picking it up at any point;[]!p_crate_8;G!p_crate_8;['p_crate_8'];Do not interact with p_crate_8 by picking it up at any point;{'crate 8': 'p_crate_8'};{'p_crate_8': 'ap_0'};G!ap_0
Stay away from street 6 at all times and also take a picture of car 1;[]!street_6&&<>(car_1&&photo);G!street_6 & F(car_1 & photo);['photo', 'street_6', 'car_1'];Stay away from street_6 at all times and also take a picture of car_1;{'photo': 'photo', 'street 6': 'street_6', 'car 1': 'car_1'};{'photo': 'ap_0', 'street_6': 'ap_1', 'car_1': 'ap_2'};G!ap_1 & F(ap_2 & ap_0)
Ensure you keep returning to parking lot 4 as you move document 4 from car 5 to car 6;[]<>parking_lot_4&&<>(car_5&&<>(p_document_4&&<>(car_6&&pd)));GFparking_lot_4 & F(car_5 & F(p_document_4 & F(car_6 & pd)));['pd', 'parking_lot_4', 'car_5', 'p_document_4', 'car_6'];Ensure you keep returning to parking_lot_4 as you move p_document_4 from car_5 to car_6;{'pd': 'pd', 'parking lot 4': 'parking_lot_4', 'car 5': 'car_5', 'document 4': 'p_document_4', 'car 6': 'car_6'};{'pd': 'ap_0', 'parking_lot_4': 'ap_1', 'car_5': 'ap_2', 'p_document_4': 'ap_3', 'car_6': 'ap_4'};GFap_1 & F(ap_2 & F(ap_3 & F(ap_4 & ap_0)))
Ensure you stay in building 2 until you make your way to path 3;building_2 U path_3;building_2 U path_3;['building_2', 'path_3'];Ensure you stay in building_2 until you make your way to path_3;{'building 2': 'building_2', 'path 3': 'path_3'};{'building_2': 'ap_0', 'path_3': 'ap_1'};ap_0 U ap_1
Eventually go to building 9 and stay there permanently, but do not enter building 9 before reaching street 6;<>[]building_9&&!building_9 U street_6;FGbuilding_9 & (!building_9 U street_6);['street_6', 'building_9'];Eventually go to building_9 and stay there permanently, but do not enter building_9 before reaching street_6;{'street 6': 'street_6', 'building 9': 'building_9'};{'street_6': 'ap_0', 'building_9': 'ap_1'};FGap_1 & (!ap_1 U ap_0)
Go to store 5 to collect box 8 and take it to house 1;<>(store_5&&<>(p_box_8&&<>(house_1&&pd)));F(store_5 & F(p_box_8 & F(house_1 & pd)));['pd', 'house_1', 'p_box_8', 'store_5'];Go to store_5 to collect p_box_8 and take it to house_1;{'pd': 'pd', 'house 1': 'house_1', 'box 8': 'p_box_8', 'store 5': 'store_5'};{'pd': 'ap_0', 'house_1': 'ap_1', 'p_box_8': 'ap_2', 'store_5': 'ap_3'};F(ap_3 & F(ap_2 & F(ap_1 & ap_0)))
Continuously take pictures of intersection 4 at regular intervals;[]<>(intersection_4&&photo);GF(intersection_4 & photo);['photo', 'intersection_4'];Continuously take pictures of intersection_4 at regular intervals;{'photo': 'photo', 'intersection 4': 'intersection_4'};{'photo': 'ap_0', 'intersection_4': 'ap_1'};GF(ap_1 & ap_0)
Eventually (you need to go to landmark 9 to take a photo and stay there);<>(landmark_9&&photo&&[]landmark_9);F(landmark_9 & photo & Glandmark_9);['photo', 'landmark_9'];Eventually (you need to go to landmark_9 to take a photo and stay there);{'photo': 'photo', 'landmark 9': 'landmark_9'};{'photo': 'ap_0', 'landmark_9': 'ap_1'};F(ap_1 & ap_0 & Gap_1)
Avoid office 4 until pick up pass 6, then you need to pick it up at house 5 and deliver it to office 4;!office_4 U p_pass_6&&<>(house_5&&<>(p_pass_6&&<>(office_4&&pd)));(!office_4 U p_pass_6) & F(house_5 & F(p_pass_6 & F(office_4 & pd)));['pd', 'office_4', 'house_5', 'p_pass_6'];Avoid office_4 until pick up p_pass_6, then you need to pick it up at house_5 and deliver it to office_4;{'pd': 'pd', 'office 4': 'office_4', 'house 5': 'house_5', 'pass 6': 'p_pass_6'};{'pd': 'ap_0', 'office_4': 'ap_1', 'house_5': 'ap_2', 'p_pass_6': 'ap_3'};(!ap_1 U ap_3) & F(ap_2 & F(ap_3 & F(ap_1 & ap_0)))
Ensure you reach statue 7 and take a picture;<>(statue_7&&photo);F(photo & statue_7);['photo', 'statue_7'];Ensure you reach statue_7 and take a picture;{'photo': 'photo', 'statue 7': 'statue_7'};{'photo': 'ap_0', 'statue_7': 'ap_1'};F(ap_0 & ap_1)
Repeatedly move crate 8 from warehouse 4 to store 8 while making regular visits to charger 2;[]<>(warehouse_4&&<>(p_crate_8&&<>(store_8&&pd)))&&[]<>charger_2;GF(warehouse_4 & F(p_crate_8 & F(pd & store_8))) & GFcharger_2;['pd', 'store_8', 'p_crate_8', 'warehouse_4', 'charger_2'];Repeatedly move p_crate_8 from warehouse_4 to store_8 while making regular visits to charger_2;{'pd': 'pd', 'store 8': 'store_8', 'crate 8': 'p_crate_8', 'warehouse 4': 'warehouse_4', 'charger 2': 'charger_2'};{'pd': 'ap_0', 'store_8': 'ap_1', 'p_crate_8': 'ap_2', 'warehouse_4': 'ap_3', 'charger_2': 'ap_4'};GF(ap_3 & F(ap_2 & F(ap_0 & ap_1))) & GFap_4
Keep remaining in locality 3 until you make your way to office 4;locality_3 U office_4;locality_3 U office_4;['office_4', 'locality_3'];Keep remaining in locality_3 until you make your way to office_4;{'office 4': 'office_4', 'locality 3': 'locality_3'};{'office_4': 'ap_0', 'locality_3': 'ap_1'};ap_1 U ap_0
Go to office 5 to collect letter 4 and take it to house 2;<>(office_5&&<>(p_letter_4&&<>(house_2&&pd)));F(office_5 & F(p_letter_4 & F(house_2 & pd)));['pd', 'house_2', 'office_5', 'p_letter_4'];Go to office_5 to collect p_letter_4 and take it to house_2;{'pd': 'pd', 'house 2': 'house_2', 'office 5': 'office_5', 'letter 4': 'p_letter_4'};{'pd': 'ap_0', 'house_2': 'ap_1', 'office_5': 'ap_2', 'p_letter_4': 'ap_3'};F(ap_2 & F(ap_3 & F(ap_1 & ap_0)))
Refrain from going to park 3 as you take a picture of monument 3;[]!park_3&&<>(monument_3&&photo);G!park_3 & F(monument_3 & photo);['photo', 'monument_3', 'park_3'];Refrain from going to park_3 as you take a picture of monument_3;{'photo': 'photo', 'monument 3': 'monument_3', 'park 3': 'park_3'};{'photo': 'ap_0', 'monument_3': 'ap_1', 'park_3': 'ap_2'};G!ap_2 & F(ap_1 & ap_0)
Eventually you need to go to monument 1 to take a picture, but do not visit monument 1 until you arrive at park 4;<>(monument_1&&photo)&&!monument_1 U park_4;F(monument_1 & photo) & (!monument_1 U park_4);['photo', 'park_4', 'monument_1'];Eventually you need to go to monument_1 to take a picture, but do not visit monument_1 until you arrive at park_4;{'photo': 'photo', 'park 4': 'park_4', 'monument 1': 'monument_1'};{'photo': 'ap_0', 'park_4': 'ap_1', 'monument_1': 'ap_2'};F(ap_2 & ap_0) & (!ap_2 U ap_1)
Reach street 5, and after that, go to house 4;<>(street_5&&<>house_4);F(street_5 & Fhouse_4);['street_5', 'house_4'];Reach street_5, and after that, go to house_4;{'street 5': 'street_5', 'house 4': 'house_4'};{'street_5': 'ap_0', 'house_4': 'ap_1'};F(ap_0 & Fap_1)
Remain in house 4 until you make your way to room 2;house_4 U room_2;house_4 U room_2;['house_4', 'room_2'];Remain in house_4 until you make your way to room_2;{'house 4': 'house_4', 'room 2': 'room_2'};{'house_4': 'ap_0', 'room_2': 'ap_1'};ap_0 U ap_1
Always avoid: go to house 4 and pick up bottle 2 at any time;[]!(house_4&&p_bottle_2);G!(house_4 & p_bottle_2);['house_4', 'p_bottle_2'];Always avoid: go to house_4 and pick up p_bottle_2 at any time;{'house 4': 'house_4', 'bottle 2': 'p_bottle_2'};{'house_4': 'ap_0', 'p_bottle_2': 'ap_1'};G!(ap_0 & ap_1)
Always stay within the boundaries of area 3;[]area_3;Garea_3;['area_3'];Always stay within the boundaries of area_3;{'area 3': 'area_3'};{'area_3': 'ap_0'};Gap_0
Go to mall 5 and stay within its boundaries indefinitely;<>[]mall_5;FGmall_5;['mall_5'];Go to mall_5 and stay within its boundaries indefinitely;{'mall 5': 'mall_5'};{'mall_5': 'ap_0'};FGap_0
Do not approach intersection 5 before reaching street 4 and delivering pass 4 from house 4 to office 1;!intersection_5 U street_4&&<>(house_4&&<>(p_pass_4&&<>(office_1&&pd)));(!intersection_5 U street_4) & F(house_4 & F(p_pass_4 & F(office_1 & pd)));['pd', 'street_4', 'house_4', 'intersection_5', 'p_pass_4', 'office_1'];Do not approach intersection_5 before reaching street_4 and delivering p_pass_4 from house_4 to office_1;{'pd': 'pd', 'street 4': 'street_4', 'house 4': 'house_4', 'intersection 5': 'intersection_5', 'pass 4': 'p_pass_4', 'office 1': 'office_1'};{'pd': 'ap_0', 'street_4': 'ap_1', 'house_4': 'ap_2', 'intersection_5': 'ap_3', 'p_pass_4': 'ap_4', 'office_1': 'ap_5'};(!ap_3 U ap_1) & F(ap_2 & F(ap_4 & F(ap_5 & ap_0)))
Eventually go to park 5;<>park_5;Fpark_5;['park_5'];Eventually go to park_5;{'park 5': 'park_5'};{'park_5': 'ap_0'};Fap_0
Ensure crate 8 is delivered from mall 5 to office 6 over and over again;[]<>(mall_5&&<>(p_crate_8&&<>(office_6&&pd)));GF(mall_5 & F(p_crate_8 & F(office_6 & pd)));['pd', 'mall_5', 'p_crate_8', 'office_6'];Ensure p_crate_8 is delivered from mall_5 to office_6 over and over again;{'pd': 'pd', 'mall 5': 'mall_5', 'crate 8': 'p_crate_8', 'office 6': 'office_6'};{'pd': 'ap_0', 'mall_5': 'ap_1', 'p_crate_8': 'ap_2', 'office_6': 'ap_3'};GF(ap_1 & F(ap_2 & F(ap_3 & ap_0)))
Ensure you stay in parking lot 4 until you capture a picture of car 5;parking_lot_4 U (car_5&&photo);parking_lot_4 U (car_5 & photo);['photo', 'parking_lot_4', 'car_5'];Ensure you stay in parking_lot_4 until you capture a picture of car_5;{'photo': 'photo', 'parking lot 4': 'parking_lot_4', 'car 5': 'car_5'};{'photo': 'ap_0', 'parking_lot_4': 'ap_1', 'car_5': 'ap_2'};ap_1 U (ap_2 & ap_0)
Refrain from entering building 8 unless you have already reached parking lot 8;!building_8 U parking_lot_8;!building_8 U parking_lot_8;['building_8', 'parking_lot_8'];Refrain from entering building_8 unless you have already reached parking_lot_8;{'building 8': 'building_8', 'parking lot 8': 'parking_lot_8'};{'building_8': 'ap_0', 'parking_lot_8': 'ap_1'};!ap_0 U ap_1
Refrain from ever picking up crate 8;[]!p_crate_8;G!p_crate_8;['p_crate_8'];Refrain from ever picking up p_crate_8;{'crate 8': 'p_crate_8'};{'p_crate_8': 'ap_0'};G!ap_0
Avoid entering street 6 while you take a picture of car 1;[]!street_6&&<>(car_1&&photo);G!street_6 & F(car_1 & photo);['photo', 'street_6', 'car_1'];Avoid entering street_6 while you take a picture of car_1;{'photo': 'photo', 'street 6': 'street_6', 'car 1': 'car_1'};{'photo': 'ap_0', 'street_6': 'ap_1', 'car_1': 'ap_2'};G!ap_1 & F(ap_2 & ap_0)
Visit parking lot 4 repeatedly while moving document 4 from car 5 to car 6;[]<>parking_lot_4&&<>(car_5&&<>(p_document_4&&<>(car_6&&pd)));GFparking_lot_4 & F(car_5 & F(p_document_4 & F(car_6 & pd)));['pd', 'parking_lot_4', 'car_5', 'p_document_4', 'car_6'];Visit parking_lot_4 repeatedly while moving p_document_4 from car_5 to car_6;{'pd': 'pd', 'parking lot 4': 'parking_lot_4', 'car 5': 'car_5', 'document 4': 'p_document_4', 'car 6': 'car_6'};{'pd': 'ap_0', 'parking_lot_4': 'ap_1', 'car_5': 'ap_2', 'p_document_4': 'ap_3', 'car_6': 'ap_4'};GFap_1 & F(ap_2 & F(ap_3 & F(ap_4 & ap_0)))
Remain at building 2 until you have reached path 3;building_2 U path_3;building_2 U path_3;['building_2', 'path_3'];Remain at building_2 until you have reached path_3;{'building 2': 'building_2', 'path 3': 'path_3'};{'building_2': 'ap_0', 'path_3': 'ap_1'};ap_0 U ap_1
Remain in building 9 permanently, but avoid entering building 9 until you reach street 6;<>[]building_9&&!building_9 U street_6;FGbuilding_9 & (!building_9 U street_6);['street_6', 'building_9'];Remain in building_9 permanently, but avoid entering building_9 until you reach street_6;{'street 6': 'street_6', 'building 9': 'building_9'};{'street_6': 'ap_0', 'building_9': 'ap_1'};FGap_1 & (!ap_1 U ap_0)
Ensure box 8 is picked up from store 5 and delivered to house 1;<>(store_5&&<>(p_box_8&&<>(house_1&&pd)));F(store_5 & F(p_box_8 & F(house_1 & pd)));['pd', 'house_1', 'p_box_8', 'store_5'];Ensure p_box_8 is picked up from store_5 and delivered to house_1;{'pd': 'pd', 'house 1': 'house_1', 'box 8': 'p_box_8', 'store 5': 'store_5'};{'pd': 'ap_0', 'house_1': 'ap_1', 'p_box_8': 'ap_2', 'store_5': 'ap_3'};F(ap_3 & F(ap_2 & F(ap_1 & ap_0)))
Ensure you take a picture of intersection 4 repeatedly over time;[]<>(intersection_4&&photo);GF(intersection_4 & photo);['photo', 'intersection_4'];Ensure you take a picture of intersection_4 repeatedly over time;{'photo': 'photo', 'intersection 4': 'intersection_4'};{'photo': 'ap_0', 'intersection_4': 'ap_1'};GF(ap_1 & ap_0)
Reach landmark 9, capture an image, and remain there forever;<>(landmark_9&&photo&&[]landmark_9);F(landmark_9 & photo & Glandmark_9);['photo', 'landmark_9'];Reach landmark_9, capture an image, and remain there forever;{'photo': 'photo', 'landmark 9': 'landmark_9'};{'photo': 'ap_0', 'landmark_9': 'ap_1'};F(ap_1 & ap_0 & Gap_1)
Do not enter office 4 until you pick pass 6 as you move pass 6 from house 5 to office 4;!office_4 U p_pass_6&&<>(house_5&&<>(p_pass_6&&<>(office_4&&pd)));(!office_4 U p_pass_6) & F(house_5 & F(p_pass_6 & F(office_4 & pd)));['pd', 'office_4', 'house_5', 'p_pass_6'];Do not enter office_4 until you pick p_pass_6 as you move p_pass_6 from house_5 to office_4;{'pd': 'pd', 'office 4': 'office_4', 'house 5': 'house_5', 'pass 6': 'p_pass_6'};{'pd': 'ap_0', 'office_4': 'ap_1', 'house_5': 'ap_2', 'p_pass_6': 'ap_3'};(!ap_1 U ap_3) & F(ap_2 & F(ap_3 & F(ap_1 & ap_0)))
Take a picture at statue 7 after visiting it;<>(statue_7&&photo);F(photo & statue_7);['photo', 'statue_7'];Take a picture at statue_7 after visiting it;{'photo': 'photo', 'statue 7': 'statue_7'};{'photo': 'ap_0', 'statue_7': 'ap_1'};F(ap_0 & ap_1)
Keep taking crate 8 from warehouse 4 to store 8 while ensuring you frequently visit charger 2;[]<>(warehouse_4&&<>(p_crate_8&&<>(store_8&&pd)))&&[]<>charger_2;GF(warehouse_4 & F(p_crate_8 & F(pd & store_8))) & GFcharger_2;['pd', 'store_8', 'p_crate_8', 'warehouse_4', 'charger_2'];Keep taking p_crate_8 from warehouse_4 to store_8 while ensuring you frequently visit charger_2;{'pd': 'pd', 'store 8': 'store_8', 'crate 8': 'p_crate_8', 'warehouse 4': 'warehouse_4', 'charger 2': 'charger_2'};{'pd': 'ap_0', 'store_8': 'ap_1', 'p_crate_8': 'ap_2', 'warehouse_4': 'ap_3', 'charger_2': 'ap_4'};GF(ap_3 & F(ap_2 & F(ap_0 & ap_1))) & GFap_4
Do not leave locality 3 until you have reached office 4;locality_3 U office_4;locality_3 U office_4;['office_4', 'locality_3'];Do not leave locality_3 until you have reached office_4;{'office 4': 'office_4', 'locality 3': 'locality_3'};{'office_4': 'ap_0', 'locality_3': 'ap_1'};ap_1 U ap_0
Ensure letter 4 is picked up from office 5 and delivered to house 2;<>(office_5&&<>(p_letter_4&&<>(house_2&&pd)));F(office_5 & F(p_letter_4 & F(house_2 & pd)));['pd', 'house_2', 'office_5', 'p_letter_4'];Ensure p_letter_4 is picked up from office_5 and delivered to house_2;{'pd': 'pd', 'house 2': 'house_2', 'office 5': 'office_5', 'letter 4': 'p_letter_4'};{'pd': 'ap_0', 'house_2': 'ap_1', 'office_5': 'ap_2', 'p_letter_4': 'ap_3'};F(ap_2 & F(ap_3 & F(ap_1 & ap_0)))
Avoid entering park 3 while completing the task of taking a picture of monument 3;[]!park_3&&<>(monument_3&&photo);G!park_3 & F(monument_3 & photo);['photo', 'monument_3', 'park_3'];Avoid entering park_3 while completing the task of taking a picture of monument_3;{'photo': 'photo', 'monument 3': 'monument_3', 'park 3': 'park_3'};{'photo': 'ap_0', 'monument_3': 'ap_1', 'park_3': 'ap_2'};G!ap_2 & F(ap_1 & ap_0)
Capture the image of monument 1 but refrain from entering monument until you have reached park 4;<>(monument_1&&photo)&&!monument_1 U park_4;F(monument_1 & photo) & (!monument_1 U park_4);['photo', 'park_4', 'monument_1'];Capture the image of monument_1 but refrain from entering monument until you have reached park_4;{'photo': 'photo', 'park 4': 'park_4', 'monument 1': 'monument_1'};{'photo': 'ap_0', 'park_4': 'ap_1', 'monument_1': 'ap_2'};F(ap_2 & ap_0) & (!ap_2 U ap_1)
Go to street 5 and then make your way to house 4;<>(street_5&&<>house_4);F(street_5 & Fhouse_4);['street_5', 'house_4'];Go to street_5 and then make your way to house_4;{'street 5': 'street_5', 'house 4': 'house_4'};{'street_5': 'ap_0', 'house_4': 'ap_1'};F(ap_0 & Fap_1)
Remain in house 4 till you arrive room 2;house_4 U room_2;house_4 U room_2;['house_4', 'room_2'];Remain in house_4 till you arrive room_2;{'house 4': 'house_4', 'room 2': 'room_2'};{'house_4': 'ap_0', 'room_2': 'ap_1'};ap_0 U ap_1
Always avoid entering house 4 and getting bottle 2;[]!(house_4&&p_bottle_2);G!(house_4 & p_bottle_2);['house_4', 'p_bottle_2'];Always avoid entering house_4 and getting p_bottle_2;{'house 4': 'house_4', 'bottle 2': 'p_bottle_2'};{'house_4': 'ap_0', 'p_bottle_2': 'ap_1'};G!(ap_0 & ap_1)
Do not exit area 3 at any point;[]area_3;Garea_3;['area_3'];Do not exit area_3 at any point;{'area 3': 'area_3'};{'area_3': 'ap_0'};Gap_0
Reach mall 5 and remain there without leaving;<>[]mall_5;FGmall_5;['mall_5'];Reach mall_5 and remain there without leaving;{'mall 5': 'mall_5'};{'mall_5': 'ap_0'};FGap_0
Never pass through parking lot 8 on your way to street 5;[]!parking_lot_8&&<>street_5;G!parking_lot_8 & Fstreet_5;['street_5', 'parking_lot_8'];Never pass through parking_lot_8 on your way to street_5;{'street 5': 'street_5', 'parking lot 8': 'parking_lot_8'};{'street_5': 'ap_0', 'parking_lot_8': 'ap_1'};G!ap_1 & Fap_0
Ensure parking lot 8 is not visited while traveling to street 5;[]!parking_lot_8&&<>street_5;G!parking_lot_8 & Fstreet_5;['street_5', 'parking_lot_8'];Ensure parking_lot_8 is not visited while traveling to street_5;{'street 5': 'street_5', 'parking lot 8': 'parking_lot_8'};{'street_5': 'ap_0', 'parking_lot_8': 'ap_1'};G!ap_1 & Fap_0
Avoid accessing parking lot 8 en route to street 5;[]!parking_lot_8&&<>street_5;G!parking_lot_8 & Fstreet_5;['street_5', 'parking_lot_8'];Avoid accessing parking_lot_8 en route to street_5;{'street 5': 'street_5', 'parking lot 8': 'parking_lot_8'};{'street_5': 'ap_0', 'parking_lot_8': 'ap_1'};G!ap_1 & Fap_0
Never enter parking lot 8 as you reach street 5;[]!parking_lot_8&&<>street_5;G!parking_lot_8 & Fstreet_5;['street_5', 'parking_lot_8'];Never enter parking_lot_8 as you reach street_5;{'street 5': 'street_5', 'parking lot 8': 'parking_lot_8'};{'street_5': 'ap_0', 'parking_lot_8': 'ap_1'};G!ap_1 & Fap_0
Always eventually visit charger 9 as you continuously taking crate 2 from warehouse 8 to store 2;[]<>charger_9&&[]<>(warehouse_8&&<>(p_crate_2&&<>(store_2&&pd)));GFcharger_9 & GF(warehouse_8 & F(p_crate_2 & F(pd & store_2)));['pd', 'charger_9', 'warehouse_8', 'p_crate_2', 'store_2'];Always eventually visit charger_9 as you continuously taking p_crate_2 from warehouse_8 to store_2;{'pd': 'pd', 'charger 9': 'charger_9', 'warehouse 8': 'warehouse_8', 'crate 2': 'p_crate_2', 'store 2': 'store_2'};{'pd': 'ap_0', 'charger_9': 'ap_1', 'warehouse_8': 'ap_2', 'p_crate_2': 'ap_3', 'store_2': 'ap_4'};GFap_1 & GF(ap_2 & F(ap_3 & F(ap_0 & ap_4)))
Ensure that you keep visiting charger 9 and keep moving crate 2 from warehouse 8 to store 2;[]<>charger_9&&[]<>(warehouse_8&&<>(p_crate_2&&<>(store_2&&pd)));GFcharger_9 & GF(warehouse_8 & F(p_crate_2 & F(pd & store_2)));['pd', 'charger_9', 'warehouse_8', 'p_crate_2', 'store_2'];Ensure that you keep visiting charger_9 and keep moving p_crate_2 from warehouse_8 to store_2;{'pd': 'pd', 'charger 9': 'charger_9', 'warehouse 8': 'warehouse_8', 'crate 2': 'p_crate_2', 'store 2': 'store_2'};{'pd': 'ap_0', 'charger_9': 'ap_1', 'warehouse_8': 'ap_2', 'p_crate_2': 'ap_3', 'store_2': 'ap_4'};GFap_1 & GF(ap_2 & F(ap_3 & F(ap_0 & ap_4)))
Persistently return to charger 9 as you repeatedly move crate 2 from warehouse 8 to store 2;[]<>charger_9&&[]<>(warehouse_8&&<>(p_crate_2&&<>(store_2&&pd)));GFcharger_9 & GF(warehouse_8 & F(p_crate_2 & F(pd & store_2)));['pd', 'charger_9', 'warehouse_8', 'p_crate_2', 'store_2'];Persistently return to charger_9 as you repeatedly move p_crate_2 from warehouse_8 to store_2;{'pd': 'pd', 'charger 9': 'charger_9', 'warehouse 8': 'warehouse_8', 'crate 2': 'p_crate_2', 'store 2': 'store_2'};{'pd': 'ap_0', 'charger_9': 'ap_1', 'warehouse_8': 'ap_2', 'p_crate_2': 'ap_3', 'store_2': 'ap_4'};GFap_1 & GF(ap_2 & F(ap_3 & F(ap_0 & ap_4)))
Continuously cycle back to charger 9 while repeatedly transferring crate 2 from warehouse 8 to store 2;[]<>charger_9&&[]<>(warehouse_8&&<>(p_crate_2&&<>(store_2&&pd)));GFcharger_9 & GF(warehouse_8 & F(p_crate_2 & F(pd & store_2)));['pd', 'charger_9', 'warehouse_8', 'p_crate_2', 'store_2'];Continuously cycle back to charger_9 while repeatedly transferring p_crate_2 from warehouse_8 to store_2;{'pd': 'pd', 'charger 9': 'charger_9', 'warehouse 8': 'warehouse_8', 'crate 2': 'p_crate_2', 'store 2': 'store_2'};{'pd': 'ap_0', 'charger_9': 'ap_1', 'warehouse_8': 'ap_2', 'p_crate_2': 'ap_3', 'store_2': 'ap_4'};GFap_1 & GF(ap_2 & F(ap_3 & F(ap_0 & ap_4)))
Avoid going to street 4 until you reach intersection 6, after which you must go to and remain in street 4;!street_4 U intersection_6&&<>[]street_4;(!street_4 U intersection_6) & FGstreet_4;['street_4', 'intersection_6'];Avoid going to street_4 until you reach intersection_6, after which you must go to and remain in street_4;{'street 4': 'street_4', 'intersection 6': 'intersection_6'};{'street_4': 'ap_0', 'intersection_6': 'ap_1'};(!ap_0 U ap_1) & FGap_0
Do not enter street 4 before reaching intersection 6 and then stay in street 4 continuously;!street_4 U intersection_6&&<>[]street_4;(!street_4 U intersection_6) & FGstreet_4;['street_4', 'intersection_6'];Do not enter street_4 before reaching intersection_6 and then stay in street_4 continuously;{'street 4': 'street_4', 'intersection 6': 'intersection_6'};{'street_4': 'ap_0', 'intersection_6': 'ap_1'};(!ap_0 U ap_1) & FGap_0
Stay away from street 4 until you arrive at intersection 6 and then proceed to and remain in street 4;!street_4 U intersection_6&&<>[]street_4;(!street_4 U intersection_6) & FGstreet_4;['street_4', 'intersection_6'];Stay away from street_4 until you arrive at intersection_6 and then proceed to and remain in street_4;{'street 4': 'street_4', 'intersection 6': 'intersection_6'};{'street_4': 'ap_0', 'intersection_6': 'ap_1'};(!ap_0 U ap_1) & FGap_0
Refrain from visiting street 4 until you have reached intersection 6, after which you must transition to and stay in street 4;!street_4 U intersection_6&&<>[]street_4;(!street_4 U intersection_6) & FGstreet_4;['street_4', 'intersection_6'];Refrain from visiting street_4 until you have reached intersection_6, after which you must transition to and stay in street_4;{'street 4': 'street_4', 'intersection 6': 'intersection_6'};{'street_4': 'ap_0', 'intersection_6': 'ap_1'};(!ap_0 U ap_1) & FGap_0
Eventually pick up box 2 from office 4 and deliver it to house 1;<>(office_4&&<>(p_box_2&&<>(house_1&&pd)));F(office_4 & F(p_box_2 & F(house_1 & pd)));['pd', 'house_1', 'office_4', 'p_box_2'];Eventually pick up p_box_2 from office_4 and deliver it to house_1;{'pd': 'pd', 'house 1': 'house_1', 'office 4': 'office_4', 'box 2': 'p_box_2'};{'pd': 'ap_0', 'house_1': 'ap_1', 'office_4': 'ap_2', 'p_box_2': 'ap_3'};F(ap_2 & F(ap_3 & F(ap_1 & ap_0)))
